1	empire in Central Europe between 1871–1918.
2	German EmpireGerman ReichNew Imperialism / World War
3	I /
4	Modern Age18711918Unification18 JanuaryAbdication of Wilhelm II9 NovemberConstitution adopted16 April 1871; 4 May 1871Obtained Colonies in the Empire15 November 1884First World War28 July 1914German Revolution3 November 1918Armistice declared11 November 1918Treaty of Versailles28 June 1919North German ConfederationFlag of the German Empire.svgKingdom of BavariaFlag of Bavaria (striped).svgKingdom of WürttembergFlagge Königreich Württemberg.svgGrand Duchy of Baden
5	Flagge Großherzogtum Baden (1871-1891).svgGrand Duchy of HesseFlagge Großherzogtum Hessen ohne Wappen.svgWeimar RepublicSecond Polish RepublicTerritory of the Saar Basin!Saar BasinFree City of DanzigLithuania!Republic of LithuaniaFirst Czechoslovak RepublicFlag of Germany (3-2 aspect ratio).svgFlag of Poland.svgFlag of Saar 1920-1935.svgFlag of the Free City of Danzig.svgFlag of Lithuania 1918-1940.svgFlag of the Czech Republic.svgFlag of the German Empire.svg!borderFlag of the German EmpireWappen Deutsches Reich - Reichsadler 1889.svgCoat of armsCoat of arms of Germany#German EmpireGerman colonial.
6	PNGGerman colonies and protectorates in 1914German Empire 1914.svgGermany on the eve of World War IDeutsches Reich (1871-1918)-de.svgGott mit uns\\"God with us\\"BerlinOfficial:GermanWhitaker's data for 1890Majority:62.8% Protestant (Lutheran, Reformed, United)EmperorWilhelm I1871–1888Friedrich III1888Wilhelm II1888–1918ChancellorOtto von Bismarck (first)1871–1890Max von Baden (last)1918Upper House187140,050,792190052,279,915191064,925,993540857.541913–19182,658,161Vereinsthaler,South German gulden, Bremen thaler,Hamburg mark,French franc,(until 1873, together)
7	German gold mark,(1873–1914)German Papiermark(1914–1918)Area and population not including colonial possessions Area source: Population source:The German Empire (Deutsches Kaiserreich, officially Deutsches Reich), also known as Imperial Germany, was the German nation state that existed from the unification of Germany in 1871 until the abdication of Kaiser Wilhelm II in 1918.
8	It was founded in 1871 when the south German states, except for Austria, joined the North German Confederation.
9	On 1 January 1871, the new constitution came into force that changed the name of the federal state and introduced the title of emperor for Wilhelm I, King of Prussia from the House of Hohenzollern.
10	Berlin remained its capital, and Otto von Bismarck remained Chancellor, the head of government.
11	As these events occurred, the Prussian-led North German Confederation and its southern German allies were still engaged in the Franco-Prussian War.
12	The German Empire consisted of 26 states, most of them ruled by royal families.
13	They included four kingdoms, six grand duchies, five duchies (six before 1876), seven principalities, three free Hanseatic cities, and one imperial territory.
14	Although Prussia was one of several kingdoms in the realm, it contained about two thirds of Germany's population and territory.
15	Prussian dominance was also established constitutionally.
16	After 1850, the states of Germany had rapidly become industrialized, with particular strengths in coal, iron (and later steel), chemicals, and railways.
17	In 1871, Germany had a population of 41 million people; by 1913, this had increased to 68 million.
18	A heavily rural collection of states in 1815, the now united Germany became predominantly urban.
19	During its 47 years of existence, the German Empire was an industrial, technological, and scientific giant, gaining more Nobel Prizes in science than any other country.
20	By 1900, Germany was the largest economy in Europe, surpassing the United Kingdom, as well as the second-largest in the world, behind only the United States.
21	From 1867 to 1878/9, Otto von Bismarck's tenure as the first and to this day longest reigning Chancellor was marked by relative liberalism, but it became more conservative afterwards.
22	Broad reforms and the Kulturkampf marked his period in the office.
23	Late in Bismarck's chancellorship and in spite of his personal opposition, Germany became involved in colonialism.
24	Claiming much of the leftover territory that was yet unclaimed in the Scramble for Africa, it managed to build the third-largest colonial empire after the British and the French ones.
25	As a colonial state, it sometimes clashed with other European powers, especially the British Empire.
26	Germany became a great power, boasting a rapidly developing rail network, the world's strongest army, and a fast-growing industrial base.
27	In less than a decade, its navy became second only to Britain's Royal Navy.
28	After the removal of Otto von Bismarck by Wilhelm II in 1890, the Empire embarked on Weltpolitik – a bellicose new course that ultimately contributed to the outbreak of World War I.
29	In addition, Bismarck's successors were incapable of maintaining their predecessor's complex, shifting, and overlapping alliances which had kept Germany from being diplomatically isolated.
30	This period was marked by various factors influencing the Emperor's decisions, which were often perceived as contradictory or unpredictable by the public.
31	In 1879, the German Empire consolidated the Dual Alliance with Austria-Hungary, followed by the Triple Alliance with Italy in 1882.
32	It also retained strong diplomatic ties to the Ottoman Empire.
33	When the great crisis of 1914 arrived, Italy left the alliance and the Ottoman Empire formally allied with Germany.
34	In the First World War, German plans to capture Paris quickly in the autumn of 1914 failed.
35	 The war on the Western Front became a stalemate.
36	The Allied naval blockade caused severe shortages of food.
37	However, Imperial Germany had  success on the Eastern Front; it occupied a large amount of territory to its east following the Treaty of Brest-Litovsk.
38	The German declaration of unrestricted submarine warfare in early 1917, contributed to bringing the United States into the war.
39	The high command under Paul von Hindenburg and Erich Ludendorff increasingly controlled the country, but in October after the failed offensive in spring 1918, the German armies were in retreat, allies Austria-Hungary and the Ottoman Empire had collapsed, and Bulgaria had surrendered.
40	The Empire collapsed in the November 1918 Revolution with the abdications of its monarchs.
41	This left a postwar federal republic and a devastated and unsatisfied populace, which later led to the rise of Adolf Hitler and Nazism.
42	HistoryBackgroundOtto von Bismarck, the visionary statesman who unified Germany with the help of his skillful political moves and the exploitation of encountered opportunities The German Confederation had been created by an act of the Congress of Vienna on 8 June 1815 as a result of the Napoleonic Wars, after being alluded to in Article 6  of the 1814 Treaty of Paris.
43	German nationalism rapidly shifted from its liberal and democratic character in 1848, called Pan-Germanism, to Prussian prime minister Otto von Bismarck's pragmatic Realpolitik.
44	Bismarck sought to extend Hohenzollern hegemony throughout the German states; to do so meant unification of the German states and the exclusion of Prussia's main German rival, Austria, from the subsequent German Empire.
45	He envisioned a conservative, Prussian-dominated Germany.
46	Three wars led to military successes and helped to persuade German people to do this: the Second Schleswig War against Denmark in 1864, the Austro-Prussian War in 1866, and the Franco-Prussian War against France in 1870–71.
47	The German Confederation ended as a result of the Austro-Prussian War of 1866 between the constituent Confederation entities of the Austrian Empire and its allies on one side and the Kingdom of Prussia and its allies on the other.
48	The war resulted in the partial replacement of the Confederation in 1867 by a North German Confederation, comprising the 22 states north of the Main.
49	The patriotic fervour generated by the Franco-Prussian War overwhelmed the remaining opposition to a unified Germany (aside from Austria) in the four states south of the Main and during November 1870 they joined the North German Confederation by treaty.
50	FoundationOn 10 December 1870, the North German Confederation Reichstag renamed the Confederation the \\"German Empire\\" and gave the title of German Emperor to William I, the King of Prussia, as Bundespräsidium of the Confederation.
51	The new constitution (Constitution of the German Confederation) and the title Emperor came into effect on 1 January 1871.
52	During the Siege of Paris on 18 January 1871, William accepted to be proclaimed Emperor in the Hall of Mirrors at the Palace of Versailles.
53	The second German Constitution, adopted by the Reichstag on 14 April 1871 and proclaimed by the Emperor on 16 April, was substantially based upon Bismarck's North German Constitution.
54	The political system remained the same.
55	The empire had a parliament called the Reichstag, which was elected by universal male suffrage.
56	However, the original constituencies drawn in 1871 were never redrawn to reflect the growth of urban areas.
57	As a result, by the time of the great expansion of German cities in the 1890s and 1900s, rural areas were grossly over-represented.
58	Die Proklamation des Deutschen Kaiserreiches by Anton von Werner (1877), depicting the proclamation of Kaiser Wilhelm (18 January 1871, Palace of Versailles).
59	From left, on the podium (in black): Crown Prince Frederick (later Frederick III), his father Emperor Wilhelm I, and Frederick I of Baden, proposing a toast to the new emperor.
60	At centre (in white): Otto von Bismarck, first Chancellor of Germany, Helmuth von Moltke the Elder, Prussian Chief of Staff.
61	Legislation also required the consent of the Bundesrat, the federal council of deputies from the 27 states.
62	Executive power was vested in the emperor, or Kaiser, who was assisted by a chancellor responsible only to him.
63	The emperor was given extensive powers by the constitution.
64	He alone appointed and dismissed the chancellor (so in practice the emperor ruled the empire through the chancellor), was supreme commander-in-chief of the armed forces, and final arbiter of all foreign affairs, and could also disband the Reichstag to call for new elections.
65	Officially, the chancellor was a one-man cabinet and was responsible for the conduct of all state affairs; in practice, the State Secretaries (bureaucratic top officials in charge of such fields as finance, war, foreign affairs, etc.) acted as unofficial portfolio ministers.
66	The Reichstag had the power to pass, amend, or reject bills and to initiate legislation.
67	However, as mentioned above, in practice the real power was vested in the emperor, who exercised it through his chancellor.
68	Although nominally a federal empire and league of equals, in practice, the empire was dominated by the largest and most powerful state, Prussia.
69	Prussia stretched across the northern two-thirds of the new Reich and contained three-fifths of its population.
70	The imperial crown was hereditary in the ruling house of Prussia, the House of Hohenzollern.
71	With the exception of 1872–1873 and 1892–1894, the chancellor was always simultaneously the prime minister of Prussia.
72	With 17 out of 58 votes in the Bundesrat, Berlin needed only a few votes from the smaller states to exercise effective control.
73	The other states retained their own governments, but had only limited aspects of sovereignty.
74	For example, both postage stamps and currency were issued for the empire as a whole.
75	Coins through one mark were also minted in the name of the empire, while higher-valued pieces were issued by the states.
76	However, these larger gold and silver issues were virtually commemorative coins and had limited circulation.
77	While the states issued their own decorations and some had their own armies, the military forces of the smaller ones were put under Prussian control.
78	Those of the larger states, such as the Kingdoms of Bavaria and Saxony, were coordinated along Prussian principles and would in wartime be controlled by the federal government.
79	The evolution of the German Empire is somewhat in line with parallel developments in Italy, which became a united nation-state a decade earlier.
80	Some key elements of the German Empire's authoritarian political structure were also the basis for conservative modernization in Imperial Japan under Meiji and the preservation of an authoritarian political structure under the tsars in the Russian Empire.
81	One factor in the social anatomy of these governments was the retention of a very substantial share in political power by the landed elite, the Junkers, resulting from the absence of a revolutionary breakthrough by the peasants in combination with urban areas.
82	Although authoritarian in many respects, the empire had some democratic features.
83	Besides universal suffrage, it permitted the development of political parties.
84	Bismarck's intention was to create a constitutional façade which would mask the continuation of authoritarian policies.
85	In the process, he created a system with a serious flaw.
86	There was a significant disparity between the Prussian and German electoral systems.
87	Prussia used a highly restrictive three-class voting system in which the richest third of the population could choose 85% of the legislature, all but assuring a conservative majority.
88	As mentioned above, the king and (with two exceptions) the prime minister of Prussia were also the emperor and chancellor of the empire – meaning that the same rulers had to seek majorities from legislatures elected from completely different franchises.
89	Universal suffrage was significantly diluted by gross over-representation of rural areas from the 1890s onward.
90	By the turn of the century, the urban-rural population balance was completely reversed from 1871; more than two-thirds of the empire's people lived in cities and towns.
91	Bismarck eraOtto von Bismarck Bismarck's domestic policies played an important role in forging the authoritarian political culture of the Kaiserreich.
92	Less preoccupied by continental power politics following unification in 1871, Germany's semi-parliamentary government carried out a relatively smooth economic and political revolution from above that pushed them along the way towards becoming the world's leading industrial power of the time.
93	Bismarck's \\"revolutionary conservatism\\" was a conservative state-building strategy designed to make ordinary Germans—not just the Junker elite—more loyal to throne and empire.
94	According to Kees van Kersbergen and Barbara Vis, his strategy was:granting social rights to enhance the integration of a hierarchical society, to forge a bond between workers and the state so as to strengthen the latter, to maintain traditional relations of authority between social and status groups, and to provide a countervailing power against the modernist forces of liberalism and socialism.
95	He created the modern welfare state in Germany in the 1880s and enacted universal male suffrage in the new German Empire in 1871.
96	He became a great hero to German conservatives, who erected many monuments to his memory and tried to emulate his policies.
97	Foreign policyBismarck's post-1871 foreign policy was conservative and sought to preserve the balance of power in Europe.
98	British historian Eric Hobsbawm concludes that he \\"remained undisputed world champion at the game of multilateral diplomatic chess for almost twenty years after 1871, [devoting] himself exclusively, and successfully, to maintaining peace between the powers\\".
99	This was a departure from his adventurous foreign policy for Prussia, where he favored strength and expansion, punctuating this by saying \\"The great question of the age are not settled by speeches and majority votes - this was the error of 1848-49 - but by iron and blood.\\"
100	Bismarck's chief concern was that France would plot revenge after its defeat in the Franco-Prussian War.
101	As the French lacked the strength to defeat Germany by themselves, they sought an alliance with Russia, which would trap Germany between the two in a war (as would ultimately happen in 1914).
102	Bismarck wanted to prevent this at all costs and maintain friendly relations with the Russians, and thereby formed an alliance with them and Austria-Hungary, the Dreikaiserbund (League of Three Emperors) in 1881.
103	The alliance was further cemented by a separate non-aggression pact with Russia called Reinsurance Treaty, which was signed in 1887.
104	During this period, individuals within the German military were advocating a preemptive strike against Russia, but Bismarck knew that such ideas were foolhardy.
105	He once wrote that \\"the most brilliant victories would not avail against the Russian nation, because of its climate, its desert, and its frugality, and having but one frontier to defend\\", and because it would leave Germany with another bitter, resentful neighbour.
106	Meanwhile, the chancellor remained wary of any foreign policy developments that looked even remotely warlike.
107	In 1886, he moved to stop an attempted sale of horses to France on the grounds that they might be used for cavalry and also ordered an investigation into large Russian purchases of medicine from a German chemical works.
108	Bismarck stubbornly refused to listen to Georg Herbert zu Munster (ambassador to France), who reported back that the French were not seeking a revanchist war, and in fact were desperate for peace at all costs.
109	Bismarck and most of his contemporaries were conservative-minded and focused their foreign policy attention on Germany's neighbouring states.
110	In 1914, 60% of German foreign investment was in Europe, as opposed to just 5% of British investment.
111	Most of the money went to developing nations such as Russia that lacked the capital or technical knowledge to industrialize on their own.
112	The construction of the Baghdad Railway, financed by German banks, was designed to eventually connect Germany with the Turkish Empire and the Persian Gulf, but it also collided with British and Russian geopolitical interests.
113	Many consider Bismarck's foreign policy as a coherent system and partly responsible for the preservation of Europe's stability.
114	It was also marked by the need to balance circumspect defensiveness and the desire to be free from the constraints of its position as a major European power.
115	Unfortunately, Bismark's successors did not pursue his foreign policy legacy.
116	For instance, Kaiser Wilhelm II, who dismissed the chancellor in 1890, let the treaty with Russia lapse in favor of Germany's alliance with Austria, which finally led to a stronger coalition-building between Russia and France.
117	ColoniesA postage stamp from the Carolines Bismarck secured a number of German colonial possessions during the 1880s in Africa and the Pacific, but he never considered an overseas colonial empire valuable due to fierce resistance to German colonial rule from the natives.
118	Thus, Germany's colonies remained badly undeveloped.
119	However they excited the interest of the religious-minded, who supported an extensive network of missionaries.
120	Germans had dreamed of colonial imperialism since 1848.
121	Bismarck began the process, and by 1884 had acquired German New Guinea.
122	By the 1890s, German colonial expansion in Asia and the Pacific (Kiauchau in China, Tientsin in China, the Marianas, the Caroline Islands, Samoa) led to frictions with the UK, Russia, Japan, and the US.
123	The largest colonial enterprises were in Africa, where the Herero Wars in what is now Namibia in 1906–07 resulted in the Herero and Namaqua Genocide EconomyBy 1900, Germany became the largest economy in Europe and the second largest in the world behind the United States.
124	Previously, the United Kingdom held that spot.
125	Germany's main economic rivals were the United Kingdom and the United States.
126	Throughout its existence, it experienced economic growth and modernization led by heavy industry.
127	In 1871, it had a largely rural population of 41 million, while by 1913 this had increased to a predominantly urban population of 68 million.
128	Industrial powerFor 30 years, Germany struggled against Britain to be Europe's leading industrial power.
129	Representative of Germany's industry was the steel giant Krupp, whose first factory was built in Essen.
130	By 1902, the factory alone became \\"A great city with its own streets, its own police force, fire department and traffic laws.
131	There are 150 kilometres of rail, 60 different factory buildings, 8,500 machine tools, seven electrical stations, 140 kilometres of underground cable and 46 overhead.
132	\\"Under Bismarck, Germany was a world innovator in building the welfare state.
133	German workers enjoyed health, accident and maternity benefits, canteens, changing rooms and a national pension scheme.
134	RailwaysLacking a technological base at first, the Germans imported their engineering and hardware from Britain, but quickly learned the skills needed to operate and expand the railways.
135	In many cities, the new railway shops were the centres of technological awareness and training, so that by 1850, Germany was self-sufficient in meeting the demands of railroad construction, and the railways were a major impetus for the growth of the new steel industry.
136	However, German unification in 1870 stimulated consolidation, nationalisation into state-owned companies, and further rapid growth.
137	Unlike the situation in France, the goal was support of industrialisation, and so heavy lines crisscrossed the Ruhr and other industrial districts, and provided good connections to the major ports of Hamburg and Bremen.
138	By 1880, Germany had 9,400 locomotives pulling 43,000 passengers and 30,000 tons of freight, and forged ahead of France.
139	The total length of German railroad tracks expanded from 21,000 kilometers in 1871 to 63,000 kilometres by 1913, establishing the largest rail network in the world after the United States, and effectively surpassing the 32,000 kilometers of rail that connected Britain in the same year.
140	IndustryKrupp Works in Essen, 1890 Industrialisation progressed dynamically in Germany, and German manufacturers began to capture domestic markets from British imports, and also to compete with British industry abroad, particularly in the U.S.
141	The German textile and metal industries had by 1870 surpassed those of Britain in organisation and technical efficiency and superseded British manufacturers in the domestic market.
142	Germany became the dominant economic power on the continent and was the second largest exporting nation after Britain.
143	Technological progress during German industrialisation occurred in four waves: the railway wave (1877–1886), the dye wave (1887–1896), the chemical wave (1897–1902), and the wave of electrical engineering (1903–1918).
144	Since Germany industrialised later than Britain, it was able to model its factories after those of Britain, thus making more efficient use of its capital and avoiding legacy methods in its leap to the envelope of technology.
145	Germany invested more heavily than the British in research, especially in chemistry, motors and electricity.
146	Germany's dominance in physics and chemistry was such that one-third of all Nobel Prizes went to German inventors and researchers.
147	The German cartel system (known as Konzerne), being significantly concentrated, was able to make more efficient use of capital.
148	Germany was not weighted down with an expensive worldwide empire that needed defense.
149	Following Germany's annexation of Alsace-Lorraine in 1871, it absorbed parts of what had been France's industrial base.
150	By 1900, the German chemical industry dominated the world market for synthetic dyes.
151	The three major firms BASF, Bayer and Hoechst produced several hundred different dyes, along with the five smaller firms.
152	In 1913, these eight firms produced almost 90% of the world supply of dyestuffs and sold about 80% of their production abroad.
153	The three major firms had also integrated upstream into the production of essential raw materials and they began to expand into other areas of chemistry such as pharmaceuticals, photographic film, agricultural chemicals and electrochemicals.
154	Top-level decision-making was in the hands of professional salaried managers; leading Chandler to call the German dye companies \\"the world's first truly managerial industrial enterprises\\".
155	There were many spinoffs from research—such as the pharmaceutical industry, which emerged from chemical research.
156	By the start of World War I (1914–1918), German industry switched to war production.
157	The heaviest demands were on coal and steel for artillery and shell production, and on chemicals for the synthesis of materials that were subject to import restrictions and for chemical weapons and war supplies.
158	ConsolidationThe creation of the Empire under Prussian leadership was a victory for the concept of Kleindeutschland (Smaller Germany) over the Großdeutschland concept.
159	This meant that Austria-Hungary, a multi-ethnic Empire with a considerable German-speaking population, would remain outside of the German nation state.
160	Bismarck's policy was to pursue a solution diplomatically.
161	The effective alliance between Germany and Austria played a major role in Germany's decision to enter World War I in 1914.
162	Bismarck announced there would be no more territorial additions to Germany in Europe, and his diplomacy after 1871 was focused on stabilizing the European system and preventing any wars.
