2775	It began with the original château, with the brick and stone and sloping slate mansard roofs of the Louis XIII style used by architect Philibert Le Roy.
2776	It then became grander and more monumental, with the addition of the colonnades and flat roofs of the new royal apartments in the French classical or Louis XIV style, as designed by Louis Le Vau and later Jules Hardouin-Mansart.
2777	It concluded in the lighter and more graceful neoclassical Louis XVI style of the Petit Trianon, completed by Ange-Jacques Gabriel in 1768.
2778	The palace was largely completed by the death of Louis XIV in 1715.
2779	The eastern facing palace has a U-shaped layout, with the corps de logis and symmetrical advancing secondary wings terminating with the Dufour Pavilion on the south and the Gabriel Pavilion to the north, creating an expansive cour d'honneur known as the Royal Court (Cour Royale).
2780	Flanking the Royal Court are two enormous asymmetrical wings that result in a facade of  in length.
2781	Encompassing  the palace has 700 rooms, more than 2,000 windows, 1,250 fireplaces and 67 staircases.
2782	The façade of Louis XIII's original château is preserved on the entrance front.
2783	Built of red brick and cut stone embellishments, the U-shaped layout surrounds a black-and-white marble courtyard.
2784	In the center, a 3-storey avant-corps fronted with eight red marble columns supporting a gilded wrought-iron balcony is surmounted with a triangle of lead statuary surrounding a large clock, whose hands were stopped upon the death of Louis XIV.
2785	The rest of the façade is completed with columns, painted and gilded wrought-iron balconies and dozens of stone tables decorated with consoles holding marble busts of Roman emperors.
2786	Atop the mansard slate roof are elaborate dormer windows and gilt lead roof dressings that were added by Hardouin-Mansart in 1679–1681.
2787	 Inspired by the architecture of baroque Italian villas, but executed in the French classical style, the garden front and wings were encased in white cut ashlar stone known as the enveloppe in 1668-1671 by Le Vau and modified by Hardouin-Mansart in 1678–1679.
2788	The exterior features an arcaded, rusticated ground floor, supporting a main floor with round-headed windows divided by reliefs and pilasters or columns.
2789	The attic storey has square windows and pilasters and crowned by a balustrade bearing sculptured trophies and flame pots dissimulating a flat roof.
2790	Royal ApartmentsPlan of the main floor in the central part of the palace (c. 1742), showing the grand appartement du roi in dark blue, the appartement du roi in medium blue, the petit appartement du roi in light blue, the grand appartement de la reine in yellow, and the petit appartement de la reine in red The construction in 1668–1671 of Le Vau's enveloppe around the outside of Louis XIII's red brick and white stone château added state apartments for the king and the queen.
2791	The addition was known at the time as the château neuf (new château).
2792	The grands appartements (Grand Apartments, also referred to as the State Apartments) include the grand appartement du roi and the grand appartement de la reine.
2793	They occupied the main or principal floor of the château neuf, with three rooms in each apartment facing the garden to the west and four facing the garden parterres to the north and south, respectively.
2794	The private apartments of the king (the appartement du roi and the petit appartement du roi) and those of the queen (the petit appartement de la reine) remained in the château vieux (old château).
2795	Le Vau's design for the state apartments closely followed Italian models of the day, including the placement of the apartments on the main floor (the piano nobile, the next floor up from the ground level), a convention the architect borrowed from Italian palace design.
2796	The king's State Apartment consisted of an enfilade of seven rooms, each dedicated to one of the known planets and their associated titular Roman deity.
2797	The queen's apartment formed a parallel enfilade with that of the grand appartement du roi.
2798	After the addition of the Hall of Mirrors (1678–1684) the king's apartment was reduced to five rooms (until the reign of Louis XV, when two more rooms were added) and the queen's to four.
2799	The queen's apartments served as the residence of three queens of France - Marie-Thérèse d'Autriche, wife of Louis XIV, Marie Leczinska, wife of Louis XV, and Marie-Antoinette, wife of Louis XVI.
2800	Additionally, Louis XIV's granddaughter-in-law, Princess Marie-Adélaïde of Savoy, duchesse de Bourgogne, wife of the Petit Dauphin, occupied these rooms from 1697 (the year of her marriage) to her death in 1712.
2801	The State Apartments of the KingthumbMeal at the House of Simon the Pharisee by Veronese in the Salon of HerculesThe Salon of AbundanceThe Salon of VenusThe Salon of MercuryThe construction of the Hall of Mirrors between 1678 and 1686 coincided with a major alteration to the State Apartments.
2802	They were originally intended as his residence, but the King transformed them into galleries for his finest paintings, and venues for his many receptions for courtiers.
2803	During the season from All-Saints Day in November until Easter, these were usually held three times a week, from six to ten in the evening, with various entertainments.
2804	The Salon of HerculesThis was originally a chapel.
2805	It was rebuilt beginning in 1712 as a showcase for the painting Meal at the House of Simon the Pharisee by Paolo Veronese, which was a gift to Louis XIV from the Republic of Venice in 1664.
2806	The painting on the ceiling, The Apotheosis of Hercules, by François Lemoyne, was completed in 1712, and gave the room its name.
2807	The Salon of AbundanceThe Salon of Abundance was the antechamber to the Cabinet of Curios (now the Games Room), which displayed Louis XIV's collection of precious jewels and rare objects.
2808	Some of the objects in the collection are depicted in René-Antoine Houasse's painting Abundance and Liberality (1683), located on the ceiling over the door opposite the windows.
2809	The Salon of VenusThis salon was used for serving light meals during evening receptions.
2810	The principal feature in this room is Jean Warin's life-size statue of Louis XIV in the costume of a Roman emperor.
2811	On the ceiling in a gilded oval frame is another painting by Houasse, Venus subjugating the Gods and Powers (1672-1681).
2812	Trompe l'oeil paintings and sculpture around the ceiling illustrate mythological themes.
2813	The Salon of Mercury
2814	The Salon of Mercury was the original State Bedchamber when Louis XIV officially moved the court and government to the Palace in 1682.
2815	The bed is a replica of the original commissioned by King Louis-Philippe in the 19th century when he turned the Palace into a Museum.
2816	The ceiling paintings by the Flemish artist Jean Baptiste de Champaigne depicts the god Mercury in his chariot, drawn by a rooster, and Alexander the Great and Ptolemy surrounded by scholars and philosophers.
2817	The Automaton Clock was made for the King by the royal clockmaker Antoine Morand in 1706.
2818	When it chimes the hour, figures of Louis XIV and Fame descend from a cloud.
2819	Salon of MarsCeiling in the Salon of Apollo, depicting the Sun Chariot of ApolloBust of Louis XIV by Bernini in Salon of DianaThe Salon of MarsThe Salon of Mars was used by the royal guards until 1782, and was decorated on a military theme with helmets and trophies.
2820	It was turned into a concert room between 1684 and 1750, with galleries for musicians on either side.
2821	Portraits of Louis XV and his Queen, Marie Leszczinska, by the Flemish artist Carle Van Loo decorate the room today.
2822	The Salon of ApolloThe Salon of Apollo was the royal throne room under Louis XIV, and was the setting for formal audiences.
2823	The eight-foot high silver throne was melted down in 1689 to help pay the costs of an expensive war, and was replaced by a more modest throne of gilded wood.
2824	The central painting on the ceiling, by Charles de la Fosse, depicts the Sun Chariot of Apollo, the King's favorite emblem, pulled by four horses and surrounded by the four seasons.
2825	The Salon of DianaThe Salon of Diana was used by Louis XIV as a billiards room, and had galleries from which courtiers could watch him play.
2826	The decoration of the walls and ceiling depicts scenes from the life of the goddess Diana.
2827	The celebrated bust of Louis XIV by Bernini made during the famous sculptor's visit to France in 1665, is on display here.
2828	Private apartments of the King and QueenThe King's bedchamberThe Queen's bedchamberThe gilded cabinet of Marie-AntoinetteBilliard Room of Marie-AntoinettePrivate apartments of the KingThe apartments of the King were the heart of the chateau; they were in the same location as the rooms of Louis XIII, the creator of the chateau, on the first floor (second floor US style).
2829	They were set aside for the personal use of Louis XIV in 1683.
2830	He and his successors Louis XV and Louis XVI used these rooms for official functions, such as the ceremonial lever (\\"waking up\\") and the coucher (\\"going to bed\\") of the monarch, which were attended by a crowd of courtiers.
2831	The King's apartment was accessed from the Hall of Mirrors from the Oeil de Boeuf antechamber past the Guardroom and the Grand Couvert, the ceremonial room where Louis XIV often took his evening meals, seated alone at a table in front of the fireplace.
2832	His spoon, fork, and knife were brought to him in a golden box.
2833	The courtiers could watch as he dined.
2834	The King's bedchamber had originally been the State Drawing Room and had been used by Queen Marie-Theresa, but after her death in 1701 Louis XIV took it over to use as his own bedroom and died there on September 1, 1715.
2835	Both Louis XV and Louis XVI continued to use the bedroom for their official awakening and going to bed.
2836	On October 6, 1789, from the balcony of this room Louis XVI and Marie-Antoinette, joined by the Marquis de Lafayette, looked down on the hostile crowd in the courtyard, shortly before the King was forced to return to Paris.
2837	The bed of the King is placed beneath a carved relief by Nicolas Coustou entitled  France watching over the sleeping King.
2838	The decoration includes several paintings set into the paneling, including a self-portrait of Antony Van Dyck.
2839	Private apartments of The QueenThe petit appartement de la reine is a suite of rooms that were reserved for the personal use of the queen.
2840	Originally arranged for the use of the Marie-Thérèse, consort of Louis XIV, the rooms were later modified for use by Marie Leszczyńska and finally for Marie-Antoinette.
2841	The Queen's apartments and the King's Apartments were laid out on the same design, each suite having seven rooms.
2842	Both suites had ceilings painted with scenes from mythology; the King's ceilings featured male figures, the Queen's featured females.
2843	The Grand GalleryThe Peace SalonThe Peace Salon; Louis XV sharing benefits of peace by François LemoyneThe Galerie des Glaces or Hall of MirrorsGuerdirons or candle holders in the Hall of MirrorsRelief of Louis XIV in the Salon of War, by Antoine Coysevox (1715)The Grand Gallery is a set of three highly decorated reception rooms, dedicated to the celebration of the political and military successes of Louis XIV, and used for important ceremonies, celebrations and receptions.
2844	The War SalonThe War Salon commemorates the victorious campaign of Louis XIV against the Dutch, which ended in 1678.
2845	The centerpiece is an enormous sculpted medallion of Louis XIV, on horseback, crossing the Rhine in 1672, created by Antoine Coysevox.
2846	Above the fireplace is a painting of Clio, the Muse of History, recording the exploits of the King.
2847	The Hall of MirrorsThe Galerie des Glaces (Hall of Mirrors), is perhaps the most famous room in the château of Versailles.
2848	It took the place of the rooftop terrace overlooking the gardens which formerly connected the apartments of the King and Queen.
2849	The construction of the room began in 1678 and finished in 1689.
2850	The gallery is more than  long, and it is lined with 17 wide arcaded mirrors, designed to match and reflect the windows opposite facing the gardens.
2851	Charles Le Brun painted thirty scenes of the early reign of Louis XIV on the ceiling.
2852	The centerpiece is a painting of the King titled, \\"The King Governing Alone\\".
2853	It shows Louis XIV, facing the powers of Europe, turning away from his pleasures to accept a crown of immortality from Glory, with the encouragement of Mars.
2854	The hall was originally furnished with solid silver furniture designed by Le Brun, but these furnishings were melted down in 1689 to help pay for war expenses.
2855	The King kept a silver throne, usually located in the Salon of Apollo, which was brought to the Hall of Mirrors for formal ceremonies, such as the welcome of foreign ambassadors, including a delegation from the King of Siam in 1686.
2856	It was also used for large events, such as full-dress and masked balls.
2857	Light was provided by candelabra on large gilded guerdirons lining the hall.
2858	Those on display today were made in 1770 for the marriage of Louis XVI and Marie Antoinette, based on the moldings of earlier silver versions made by LeBrun that had been melted down.
2859	The twenty-four crystal chandeliers were hung only for special occasions.
2860	Courtiers gathered in the Hall to watch the King walk from his apartments to the chapel, and sometimes took the occasion to present him with requests.
2861	The Peace SalonThe Peace Salon is decorated to illustrate the role of France as the arbiter and peacemaker of Europe under Louis XV.
2862	The painting on the ceiling by François Lemoyne, Louis XV offering an olive branch to Europe, illustrates this theme.
2863	During the reign of Louis XV, the Queen, Marie Leszczyńska, used this salon as a music room, organizing concerts of secular and religious music each Sunday.
2864	Royal ChapelRoyal Chapel seen from the ground floor The Royal Chapel, seen from the Royal GalleryThe Royal Chapel, the tallest building of the PalaceAltar and organ of the Royal ChapelGlory holding a portrait of Louis XV, by Antoine Vassé, in the chapel vestibuleThe Chapel was the last building at Versailles to be completed during the reign of Louis XIV.
2865	It was consecrated in 1710, and was dedicated to Louis IX of France, the ancestor and patron saint of the King.
2866	Construction was begun by Hardouin-Mansart in 1699, and was completed by de Corte.
2867	Daily services, wedding ceremonies, and baptisms were held in this chapel until 1789.
2868	Like other royal chapels, it had two levels: the King and family worshipped in the Royal Gallery on the upper level, while ordinary courtiers stood on the ground level.
2869	The paintings on the ceiling display scenes depicting the three figures of the trinity.
2870	In the center is The Glory of the Father Announcing the Coming of the Messiah by Antoine Coypel, above the altar is The Resurrection of Christ, and above the royal gallery is The Holy Spirit Descending Upon the Virgin and the Apostles.
2871	The corridor and vestibule that connected the Chapel and the State Apartments included later art, commissioned by Louis XV, intended to portray the link between Divinity and the King: a statue of Glory Holding the Medallion of Louis XV, by Antoine Vassé; and Royal Magnanimity by Jacques Bousseau.
2872	Royal OperaThe Royal BoxFoyer of the Royal OperaThe Royal Opera during the celebration of the marriage of Louis XVI and Marie-Antoinette (1770)Stage of the Royal OperaCeiling of the opera, painted by Louis Jean-Jacques Durameau
2873	The Royal Opera of Versailles was originally commissioned by Louis XIV in 1682 and was to be built at the end of the North Wing with a design by Mansart and Vigarani.
2874	However, due to the expense of the King's continental wars, the project was put aside.
2875	The idea was revived by Louis XV with a new design by Ange-Jacques Gabriel in 1748, but this also was temporarily put aside.
2876	The project was revived and rushed ahead for the planned celebration of the marriage of the Dauphin, the future Louis XVI, and Marie-Antoinette.
2877	For economy and speed, the new opera was built almost entirely of wood, which also gave it very high quality acoustics.
2878	The wood was painted to resemble marble, and the ceiling was decorated with a painting of the Apollo, the god of the arts, preparing crowns for illustrious artists, by Louis Jean-Jacques Durameau.
2879	The sculptor Augustin Pajou added statuary and reliefs to complete the decoration.
2880	The new Opera was inaugurated on May 16, 1770, as part of the celebration of the royal wedding.
2881	In October 1789, early in the French Revolution, the last banquet for the royal guardsmen was hosted by the King in the opera, before he departed for Paris.
2882	Following the Franco-German War in 1871 and then the Paris Commune until 1875, the French National Assembly met in the opera, until the proclamation of the Third French Republic and the return of the government to Paris.
2883	Museum of the History of FranceLouis Philippe dedicates the Gallery of Battles, by François Joseph Heim (1837)thumbright200pxThe Gallery of Battles in the Museum of the History of FranceThe Battle of Taillebourg, by Eugène Delacroix (1837)Louis Philippe and his sons pose before the gates of Versailles, by Horace Vernet History Gallery, (1846)
2884	Shortly after becoming King in 1830, Louis Philippe I decided to transform the Palace, which was empty of furnishings and in poor repair, into a museum devoted to \\"All the Glories of France,\\" with paintings and sculpture depicting famous French victories and heroes.
2885	The walls of the apartments of the courtiers and lesser members of the royal family on the first floor (second floor U.S. style) were demolished, and turned into a series of several large galleries: the Coronation Room, which displays the celebrated painting of the coronation of Napoleon I by Jacques-Louis David; the Hall of Battles; commemorating French victories with large-scale paintings; and the 1830 room, which celebrated Louis-Philippe's own coming tol power in the French Revolution of 1830.
2886	Some paintings were brought from the Louvre, including works depicting events in French history by Philippe de Champaigne, Pierre Mignard, Laurent de La Hyre, Charles Le Brun, Adam Frans van der Meulen, Nicolas de Largillière, Hyacinthe Rigaud, Jean-Antoine Houdon, Jean-Marc Nattier, Élisabeth Vigée Le Brun, Hubert Robert, Thomas Lawrence, Jacques-Louis David, and Antoine-Jean Gros.
2887	Others were commissioned especially for the museum by prominent artists of the early 19th century, including Eugène Delacroix, who painted Saint Louis at the French victory over the British in the Battle of Taillebourg in 1242.
2888	Other painters featured include Horace Vernet and François Gérard.
2889	A monumental painting by Vernet features Louis Philippe himself, with his sons, posing in front of the gates of the Palace.
2890	The overthrow of Louis Philippe in 1848 put an end to his grand plans for the museum, but the Gallery of Battles is still as it was, and is passed through by many visitors to the royal apartments and grand salons.
2891	Another set of rooms on the first floor has been made into galleries on Louis XIV and his court, displaying furniture, paintings, and sculpture.
2892	In recent years, eleven rooms on the ground floor between the Chapel and the Opera have been turned into a history of the palace, with audiovisual displays and models.
2893	Gardens and fountainsBassin de Flore (1672-1679)thumbThe Orangerie gardenFountain of Latona, with the Grand Canal in the backgroundAndré Le Nôtre began transforming the park and gardens of Versailles in the early 1660s.
2894	They are the finest example of the jardin à la française, or the French formal garden.
2895	They were originally designed to be viewed from the terrace on the west side of the palace, and to create a grand perspective that reached to the horizon, illustrating the king's complete dominance over nature.
2896	The Parterre d'Eau and the Parterre and Fountain of Latona
2897	The features closest to the Palace are the two water parterres, large pools which reflect the facade of the palace.
2898	These are decorated with smaller works of sculpture, representing the rivers of France, which are placed so as not to interfere with the reflections in the water.
2899	Down a stairway from the Parterre d'Eau is the Latona Fountain, created in 1670, illustrating the story of Latona taken from the Metamorphoses of Ovid.
2900	According to the story, when the peasants of Lycia insulted Latona, the mother of Apollo and Diana, the god Jupiter transformed the peasants into frogs.
2901	The fountain was begun in 1670 by Le Nôtre, then enlarged and modified by Hardouin-Mansart, who placed the statue of Latona atop a marble pyramid.
2902	Fountain of the Chariot of Apollo and the Grand CanalThe Grand Perspective of the palace continues from the Fountain of Latona south along a grassy lane, the Tapis Vert or green carpet, to the Basin of the Chariot of Apollo.
2903	Apollo, the sun god, was the emblem of Louis XIV, featured in much of the decoration of the palace.
2904	The chariot rising from the water symbolized the rising of the sun.
2905	It was designed by Le Brun and made by the sculptor Jean-Baptiste Tuby between 1668 and 1670, cast in iron and then gilded.
2906	Beyond the fountain, the Grand Canal extends 1800 meters to the south end of the park.
2907	North Parterre, Dragon Basin, and Basin of NeptuneAnother group of formal gardens is located on the north side of the water parterre.
2908	It includes two bosquets or groves: the grove of the Three Fountains, The Bosquet of the Arch of Triumph, and north of these, three major fountains, the Pyramid Fountain, Dragon Fountain, and the Neptune Fountain.
2909	The fountains in this area all have a maritime or aquatic theme; the Pyramid Fountain is decorated with Tritons, Sirens, dolphins and nymphs.
2910	The Dragon Fountain is one of the oldest at Versailles and has the highest jet of water, twenty-seven meters.
2911	It is not actually a dragon, but a python, a mythical serpent that was killed by Apollo.
2912	The Neptune Fountain was originally decorated only with a circle of large lead basins jetting water; Louis XV added statues of Neptune, Triton and other gods of the sea.
2913	South Parterre and the OrangerieThe South Parterre is located beneath the windows of the queen's apartments and on the roof of the Orangerie.
2914	It is decorated with box trees and flowers in arabesque patterns.
2915	The underground orangerie was designed to hold over a thousand citrus fruit, palms and oleanders, and other southern-climate trees during winter.
2916	They are taken out into the gardens from mid-May until mid-October.
2917	The Fountains and the Shortage of WaterSupplying water for the fountains of Versailles was a major problem for the royal government.
2918	The 18th-century waterworks at Marly— the Machine de Marly that fed the fountains— was possibly the biggest mechanical system of its time.
2919	The water came in from afar on monumental stone aqueducts which have long ago fallen into disrepair or been torn down.
2920	Some aqueducts, such as the unfinished Canal de l'Eure, which passes through the gardens of the Château de Maintenon, were never completed for want of resources or due to the exigencies of war.
2921	Despite enormous investment in canals and machinery for hoisting water, Versailles never had a sufficient water supply for its hundreds of fountains.
2922	When the King promenaded in the gardens, fountains were turned on only when the King was approaching them, and turned off after he departed.
2923	Today, only a few fountains are supplied with water, and only operate on a very limited schedule.
2924	The Bosquets or GrovesThe Three Fountains BosquetThe Ballroom Bosquet The Colonnade BosquetThe largest part of the garden is divided into geometric bosquets, compartment-like groves; eight on the north side of the garden, and six to the south.
2925	The bosquets were created for Louis XIV between 1680 and 1690.
2926	They were bordered with high trees and carefully trimmed in cubic forms to resemble rooms with walls of greenery.
2927	Each bosquet had its own theme and fountains, statuary, grottoes, and other decoration.
2928	Some were highly formal, like Hardouin-Mansart's Bosquet de la Colonnade, with a circle of columns alternating with fountains, while others imitated nature.
2929	They were often used for concerts or theatrical performances.
2930	Some of the early groves were altered beyond recognition by later monarchs, but the most famous bosquets, Le Nôtre's Salle de Bal (literally, \\"ballroom\\"), also known as the Bosquet des Rocailles (c. 1685), and Hardouin-Mansart's Bosquet de la Colonnade, have both been restored to the way they were under Louis XIV.
2931	Other notable groves include Les Dômes, the Bosquet d'Encelade (after Enceladus, c. 1675), the Théâtre d'Eau (Water Theater), and the Bains d'Apollon (Baths of Apollo).
2932	Some are now decorated with contemporary works of art.
2933	The Grand Trianon and Petit TrianonPeristyle of the Grand TrianonWest facade of the Petit TrianonThe Temple of LoveThe Queen's Theater at the Petit TrianonIn 1668 Louis XIV decided to build a smaller palace some distance from the main palace, where he could spend quieter time away from the crowds and formality of his Court.
