1745	Until 2011, military service was compulsory for men at age 18, and conscripts served six-month tours of duty; conscientious objectors could instead opt for an equal length of Zivildienst (civilian service), or a six-year commitment to (voluntary) emergency services like a fire department or the Red Cross.
1746	In 2011 conscription was officially suspended and replaced with a voluntary service.
1747	EconomyFrankfurt is a leading business centre in Europe and seat of the ECB.
1748	Germany has a social market economy with a highly skilled labour force, a large capital stock, a low level of corruption, and a high level of innovation.
1749	It is the world's third largest exporter of goods, and has the largest national economy in Europe which is also the world's fourth largest by nominal GDP and the fifth one by PPP.
1750	Mercedes-AMG GT roadster.
1751	Germany maintains a large automotive industry, and is the world's third largest exporter of goods.
1752	The service sector contributes approximately 71% of the total GDP (including information technology), industry 28%, and agriculture 1%.
1753	The unemployment rate published by Eurostat amounts to 4.7% in January 2015, which is the lowest rate of all 28 EU member states.
1754	With 7.1% Germany also has the lowest youth unemployment rate of all EU member states.
1755	According to the OECD Germany has one of the highest labour productivity levels in the world.
1756	Germany is part of the European single market which represents more than 508 million consumers.
1757	Several domestic commercial policies are determined by agreements among European Union (EU) members and by EU legislation.
1758	Germany introduced the common European currency, the Euro in 2002.
1759	It is a member of the Eurozone which represents around 340 million citizens.
1760	Its monetary policy is set by the European Central Bank, which is headquartered in Frankfurt, the financial centre of continental Europe.
1761	Being home to the modern car, the automotive industry in Germany is regarded as one of the most competitive and innovative in the world, and is the fourth largest by production.
1762	The top 10 exports of Germany are vehicles, machinery, chemical goods, electronic products, electrical equipments, pharmaceuticals, transport equipments, basic metals, food products, and rubber and plastics.
1763	CompaniesOf the world's 500 largest stock-market-listed companies measured by revenue in 2014, the Fortune Global 500, 28 are headquartered in Germany.
1764	30 major Germany-based companies are included in the DAX, the prime German stock market index which is operated by Frankfurt Stock Exchange of Deutsche Börse.
1765	Well-known international brands include Mercedes-Benz, BMW, SAP, Volkswagen, Audi, Siemens, Allianz, Adidas, Porsche, Deutsche Bahn, Deutsche Bank, Bosch and Babelsberg.
1766	Germany is recognised for its large portion of specialised small and medium enterprises, known as the Mittelstand model.
1767	More than 1,000 of these companies are global market leaders in their segment and are labelled hidden champions.
1768	Berlin developed a thriving, cosmopolitan hub for startup companies and became the leading location for venture capital funded firms in the European Union.
1769	The list includes the largest German companies by revenue in 2015:Germany is part of a monetary union, the eurozone (dark blue), and of the EU single market.
1770	Rank style=\\"text-align:center;\\" Name style=\\"text-align:center;\\" Headquarters style=\\"text-align:center;\\" Revenue(bil.
1771	€)  style=\\"text-align:center;\\" Profit(bil. €)  style=\\"text-align:center;\\" Employees(World)01.
1772	VolkswagenWolfsburg237−1.5610,00002.
1773	DaimlerStuttgart1669.3284,00003.
1774	E.ONEssen129−7.856,50004.
1775	AllianzMunich1237.3142,50005.
1776	BMWMunich1027.0122,00006.
1777	SiemensBerlin, Munich888.3348,00007.
1778	Robert BoschStuttgart783.5375,00008.
1779	BASFLudwigshafen784.4108,00009.
1780	Deutsche TelekomBonn773.6226,000010.
1781	MetroDüsseldorf710.8204,000TransportThe ICE 3 in Cologne railway station With its central position in Europe, Germany is a transport hub for the continent.
1782	Like its neighbours in Western Europe, Germany's road network is among the densest in the world.
1783	The motorway (Autobahn) network ranks as the third-largest worldwide in length and is known for its lack of a general speed limit.
1784	Germany has established a polycentric network of high-speed trains.
1785	The InterCityExpress or ICE network of the Deutsche Bahn serves major German cities as well as destinations in neighbouring countries with speeds up to .
1786	The German railways are subsidised by the government, receiving €17.0 billion in 2014.
1787	The largest German airports are Frankfurt Airport and Munich Airport, both hubs of Lufthansa.
1788	Other major airports include Berlin Tegel, Düsseldorf, Berlin Schönefeld, Hamburg, Cologne/Bonn and Leipzig/Halle.
1789	The Port of Hamburg is one of the top twenty largest container ports in the world.
1790	Energy and infrastructureElectricity production in Germany from 1980 to 2012 , Germany was the world's sixth-largest consumer of energy, and 60% of its primary energy was imported.
1791	In 2014, energy sources were: oil (35.0%); coal, including lignite (24.6%); natural gas (20.5%); nuclear (8.1%); hydro-electric and renewable sources (11.1%).
1792	The government and the nuclear power industry agreed to phase out all nuclear power plants by 2021.
1793	It also enforces energy conservation, green technologies, emission reduction activities, and aims to meet the country's electricity demands using 40% renewable sources by 2020.
1794	Germany is committed to the Paris Agreement and several other treaties promoting biodiversity, low emission standards, water management, and the renewable energy commercialisation.
1795	The country's household recycling rate is among the highest in the world—at around 65%.
1796	Nevertheless, the country's total greenhouse gas emissions were the highest in the EU .
1797	The German energy transition (Energiewende) is the recognised move to a sustainable economy by means of energy efficiency and renewable energy.
1798	Science and technologyAlbert Einstein, physicist.
1799	The Nobel Prize has been awarded to 107 German laureates.
1800	Germany is a global leader in science and technology as its achievements in the fields of science and technology have been significant.
1801	Research and development efforts form an integral part of the economy.
1802	The Nobel Prize has been awarded to 107 German laureates.
1803	It produces the second highest number of graduates in science and engineering (31%) after South Korea.
1804	In the beginning of the 20th century, German laureates had more awards than those of any other nation, especially in the sciences (physics, chemistry, and physiology or medicine).
1805	Notable German physicists before the 20th century include Hermann von Helmholtz, Joseph von Fraunhofer and Gabriel Daniel Fahrenheit, among others.
1806	Albert Einstein introduced the special relativity and general relativity theories for light and gravity in 1905 and 1915 respectively.
1807	Along with Max Planck, he was instrumental in the introduction of quantum mechanics, in which Werner Heisenberg and Max Born later made major contributions.
1808	Wilhelm Röntgen discovered X-rays.
1809	Otto Hahn was a pioneer in the fields of radiochemistry and discovered nuclear fission, while Ferdinand Cohn and Robert Koch were founders of microbiology.
1810	Numerous mathematicians were born in Germany, including Carl Friedrich Gauss, David Hilbert, Bernhard Riemann, Gottfried Leibniz, Karl Weierstrass, Hermann Weyl, Felix Klein and Emmy Noether.
1811	European Space Operations Centre (ESOC) in Darmstadt Germany has been the home of many famous inventors and engineers, including Hans Geiger, the creator of the Geiger counter; and Konrad Zuse, who built the first fully automatic digital computer.
1812	Such German inventors, engineers and industrialists as Count Ferdinand von Zeppelin, Otto Lilienthal, Gottlieb Daimler, Rudolf Diesel, Hugo Junkers and Karl Benz helped shape modern automotive and air transportation technology.
1813	German institutions like the German Aerospace Center (DLR) are the largest contributor to ESA.
1814	Aerospace engineer Wernher von Braun developed the first space rocket at Peenemünde and later on was a prominent member of NASA and developed the Saturn V Moon rocket.
1815	Heinrich Rudolf Hertz's work in the domain of electromagnetic radiation was pivotal to the development of modern telecommunication.
1816	Research institutions in Germany include the Max Planck Society, the Helmholtz Association, the Fraunhofer Society and the Leibniz Association.
1817	The Wendelstein 7-X in Greifswald hosts a facility in the research of fusion power for instance.
1818	The Gottfried Wilhelm Leibniz Prize is granted to ten scientists and academics every year.
1819	With a maximum of €2.5 million per award it is one of the highest endowed research prizes in the world.
1820	TourismNeuschwanstein Castle in Bavaria Germany is the seventh most visited country in the world, with a total of 407 million overnights during 2012.
1821	This number includes 68.83 million nights by foreign visitors.
1822	In 2012, over 30.4 million international tourists arrived in Germany.
1823	Berlin has become the third most visited city destination in Europe.
1824	Additionally, more than 30% of Germans spend their holiday in their own country, with the biggest share going to Mecklenburg-Vorpommern.
1825	Domestic and international travel and tourism combined directly contribute over EUR43.2 billion to German GDP.
1826	Including indirect and induced impacts, the industry contributes 4.5% of German GDP and supports 2 million jobs (4.8% of total employment).
1827	Germany is well known for its diverse tourist routes, such as the Romantic Road, the Wine Route, the Castle Road, and the Avenue Road.
1828	The German Timber-Frame Road (Deutsche Fachwerkstraße) connects towns with examples of these structures.
1829	Germany's most-visited landmarks include e.g. Neuschwanstein Castle, Cologne Cathedral, Berlin Bundestag, Hofbräuhaus Munich, Heidelberg Castle, Dresden Zwinger, Fernsehturm Berlin and Aachen Cathedral.
1830	The Europa-Park near Freiburg is Europe's second most popular theme park resort.
1831	DemographicsGerman population development from 1800 to 2010 With a population of 80.2 million according to the 2011 census, rising to at least 81.9 million , Germany is the most populous country in the European Union, the second most populous country in Europe after Russia, and the 16th most populous country in the world.
1832	Its population density stands at 227 inhabitants per square kilometre (588 per square mile).
1833	The overall life expectancy in Germany at birth is 80.19 years (77.93 years for males and 82.58 years for females).
1834	The fertility rate of 1.41 children born per woman (2011 estimates), or 8.33 births per 1000 inhabitants, is one of the lowest in the world.
1835	Since the 1970s, Germany's death rate has exceeded its birth rate.
1836	However, Germany is witnessing increased birth rates and migration rates since the beginning of the 2010s, particularly a rise in the number of well-educated migrants.
1837	Four sizeable groups of people are referred to as \\"national minorities\\" because their ancestors have lived in their respective regions for centuries: There is a Danish minority (about 50,000) in the northernmost state of Schleswig-Holstein; the Sorbs, a Slavic population of about 60,000, are in the Lusatia region of Saxony and Brandenburg.; the Roma and Sinti live throughout country; and the Frisians are concentrated in Schleswig-Holstein's western coast and in the north-western part of Lower Saxony.
1838	Approximately 5 million Germans live abroad (Auslandsdeutsche).
1839	Immigrant populationProportion of Germans without a migrant background (2016) After the United States, Germany is the second most popular immigration destination in the world.
1840	, about ten million of Germany's 82 million residents did not have German citizenship, which makes up 12% of the country's population.
1841	The majority of migrants live in western Germany, in particular in urban areas.
1842	Germany is home to the second-highest number of international migrants.
1843	The Federal Statistical Office classifies the citizens by immigrant background.
1844	Regarding the immigrant background, 22.5% of the country's residents, or more than 18.6 million people, were of immigrant or partially immigrant descent in 2016 (including persons descending or partially descending from ethnic German repatriates).
1845	In 2015, 36% of children under 5 were of immigrant or partially immigrant descent.
1846	In 2011 census, as people with immigrant background (Personen mit Migrationshintergrund) were counted all immigrants, including ethnic Germans that came to the federal republic or had at least one parent settling here after 1955.
1847	The largest part of people with immigrant background is made up of returning ethnic Germans (Aussiedler and Spätaussiedler), followed by Turkish, European Union, and former Yugoslav citizens.
1848	In the 1960s and 1970s, the German governments invited \\"guest workers\\" (Gastarbeiter) to migrate to Germany for work in the German industries.
1849	Many companies preferred to keep these workers employed in Germany after they had trained them and Germany's immigrant population has steadily increased.
1850	In 2015, the Population Division of the United Nations Department of Economic and Social Affairs listed Germany as host to the second-highest number of international migrants worldwide, about 5% or 12 million of all 244 million migrants.
1851	Germany ranks 7th amongst EU countries and 37th globally in terms of the percentage of migrants who made up part of the country's population.
1852	, the largest national group was from Turkey (2,859,000), followed by Poland (1,617,000), Russia (1,188,000), and Italy (764,000).
1853	740,000 people have African origins, an increase of 46% since 2011.
1854	Since 1987, around 3 million ethnic Germans, mostly from the former Eastern Bloc countries, have exercised their right of return and emigrated to Germany.
1855	ReligionUpon its establishment in 1871, Germany was about two-thirds Protestant and one-third Roman Catholic, with a notable Jewish minority.
1856	Other faiths existed in the state, but never achieved a demographic significance and cultural impact of these three confessions.
1857	Germany lost nearly all of its Jewish minority during the Holocaust.
1858	Religious makeup changed gradually in the decades following 1945, with West Germany becoming more religiously diversified through immigration and East Germany becoming overwhelmingly irreligious through state policies.
1859	It continues to diversify after the German reunification in 1990, with an accompanying substantial decline in religiosity throughout all of Germany and a contrasting increase of evangelical Protestants and Muslims.
1860	Geographically, Protestantism is concentrated in the northern, central and eastern parts of the country.
1861	These are mostly members of the EKD, which encompasses Lutheran, Reformed and administrative or confessional unions of both traditions dating back to the Prussian Union of 1817.
1862	Roman Catholicism is concentrated in the south and west.
1863	According to the 2011 German Census, Christianity is the largest religion in Germany, claiming 66.8% of the total population.
1864	Relative to the whole population, 31.7% declared themselves as Protestants, including members of the Evangelical Church in Germany (EKD) (30.8%) and the free churches (Evangelische Freikirchen) (0.9%), and 31.2% declared themselves as Roman Catholics.
1865	Orthodox believers constituted 1.3%.
1866	Other religions accounted for 2.7%.
1867	According to the most recent data from 2016, the Catholic Church and the Evangelical Church claimed respectively 28.5% and 27.5% of the population.
1868	Both large churches have lost significant numbers of adherents in recent years.
1869	In 2011, 33% of Germans were not members of officially recognised religious associations with special status.
1870	Irreligion in Germany is strongest in the former East Germany, which used to be predominantly Protestant before state atheism, and major metropolitan areas.
1871	An 2017 estimate even shows that 37,0 % of the German population were nonconfessional.
1872	Islam is the second largest religion in the country.
1873	In the 2011 census, 1.9% of the census population (1.52 million people) gave their religion as Islam, but this figure is deemed unreliable because a disproportionate number of adherents of this religion (and other religions, such as Judaism) are likely to have made use of their right not to answer the question.
1874	Figures from Religionswissenschaftlicher Medien- und Informationsdienst suggest a figure of 4.4 to 4.7 million (around 5.5% of the population) in 2015.
1875	A study conducted by the Federal Office for Migration and Refugees found that between 2011 and 2015 the Muslim population rose by 1.2 million people, mostly due to immigration.
1876	Most of the Muslims are Sunnis and Alevites from Turkey, but there are a small number of Shi'ites, Ahmadiyyas and other denominations.
1877	Other religions comprising less than one per cent of Germany's population are Buddhism with 270,000 adherents, Judaism with 200,000 adherents, and Hinduism with some 100,000 adherents.
1878	All other religious communities in Germany have fewer than 50,000 adherents each.
1879	LanguagesThe Goethe Institut, a German language academy, in São Paulo, Brazil German is the official and predominant spoken language in Germany.
1880	Standard German is a West Germanic language and is closely related to and classified alongside Low German, Dutch, Afrikaans, Frisian and English.
1881	To a lesser extent, it is also related to the North Germanic languages, and the extinct East Germanic languages, to an even lesser extent.
1882	Most German vocabulary is derived from the Germanic branch of the Indo-European language family.
1883	Significant minorities of words are derived from Latin and Greek, with a smaller amount from French and most recently English (known as Denglisch).
1884	German is written using the Latin alphabet.
1885	German dialects, traditional local varieties traced back to the Germanic tribes, are distinguished from varieties of standard German by their lexicon, phonology, and syntax.
1886	It is one of 24 official and working languages of the European Union, and one of the three working languages of the European Commission.
1887	German is the most widely spoken first language in the European Union, with around 100 million native speakers.
1888	Recognised native minority languages in Germany are Danish, Low German, Low Rhenish, Sorbian, Romany, North Frisian and Saterland Frisian; they are officially protected by the European Charter for Regional or Minority Languages.
1889	The most used immigrant languages are Turkish, Kurdish, Polish, the Balkan languages, and Russian.
1890	Germans are typically multilingual: 67% of German citizens claim to be able to communicate in at least one foreign language and 27% in at least two.
1891	The Goethe-Institut is a non-profit German cultural association operational worldwide with 159 institutes.
1892	It is offering the study of the German language and encouraging global cultural exchange.
1893	EducationResponsibility for educational supervision in Germany is primarily organised within the individual federal states.
1894	Optional kindergarten education is provided for all children between three and six years old, after which school attendance is compulsory for at least nine years.
1895	Primary education usually lasts for four to six years.
1896	Secondary education includes three traditional types of schools focused on different academic levels: the Gymnasium enrols the most gifted children and prepares students for university studies; the Realschule for intermediate students lasts six years and the Hauptschule prepares pupils for vocational education.
1897	The Gesamtschule unifies all secondary education.
1898	A system of apprenticeship called Duale Ausbildung leads to a skilled qualification which is almost comparable to an academic degree.
1899	It allows students in vocational training to learn in a company as well as in a state-run trade school.
1900	This model is well regarded and reproduced all around the world.
1901	Most of the German universities are public institutions, and students traditionally study without fee payment.
1902	The general requirement for university is the Abitur.
1903	However, there are a number of exceptions, depending on the state, the college and the subject.
1904	Tuition free academic education is open to international students and is increasingly common.
1905	According to an OECD report in 2014, Germany is the world's third leading destination for international study.
1906	Germany has a long tradition of higher education.
1907	The established universities in Germany include some of the oldest in the world, with Heidelberg University (established in 1386) being the oldest.
1908	It is followed by the Leipzig University (1409), the Rostock University (1419) and the Greifswald University (1456).
1909	The University of Berlin, founded in 1810 by the liberal educational reformer Wilhelm von Humboldt, became the academic model for many European and Western universities.
1910	In the contemporary era Germany has developed eleven Universities of Excellence: Humboldt University Berlin, the University of Bremen, the University of Cologne, TU Dresden, the University of Tübingen, RWTH Aachen, FU Berlin, Heidelberg University, the University of Konstanz, LMU Munich, and the Technical University of Munich.
1911	HealthThe Hospice of the Holy Spirit in Lübeck, established in 1286, is a precursor to modern hospitals.
1912	Germany's system of hospices, called Krankenhaus, dates from medieval times, and today, Germany has the world's oldest universal health care system, dating from Bismarck's social legislation of the 1880s, Since the 1880s, reforms and provisions have ensured a balanced health care system.
1913	Currently the population is covered by a health insurance plan provided by statute, with criteria allowing some groups to opt for a private health insurance contract.
1914	According to the World Health Organization, Germany's health care system was 77% government-funded and 23% privately funded .
1915	In 2014, Germany spent 11.3% of its GDP on health care.
1916	Germany ranked 20th in the world in life expectancy with 77 years for men and 82 years for women, and it had a very low infant mortality rate (4 per 1,000 live births).
1917	, the principal cause of death was cardiovascular disease, at 41%, followed by malignant tumours, at 26%.
1918	, about 82,000 Germans had been infected with HIV/AIDS and 26,000 had died from the disease (cumulatively, since 1982).
1919	According to a 2005 survey, 27% of German adults are smokers.
1920	Obesity in Germany has been increasingly cited as a major health issue.
1921	A 2007 study shows Germany has the highest number of overweight people in Europe.
1922	CultureA typical German Weihnachtsmarkt (Christmas market) in Jena Culture in German states has been shaped by major intellectual and popular currents in Europe, both religious and secular.
1923	Historically, Germany has been called Das Land der Dichter und Denker (\\"the land of poets and thinkers\\"), because of the major role its writers and philosophers have played in the development of Western thought.
1924	Germany is well known for such folk festival traditions as Oktoberfest and Christmas customs, which include Advent wreaths, Christmas pageants, Christmas trees, Stollen cakes, and other practices.
1925	 UNESCO inscribed 41 properties in Germany on the World Heritage List.
1926	There are a number of public holidays in Germany determined by each state; 3 October has been a national day of Germany since 1990, celebrated as the Tag der Deutschen Einheit (German Unity Day).
1927	Prior to reunification, the day was celebrated on 17 June, in honour of the Uprising of 1953 in East Germany which was brutally suppressed on that date.
1928	In the 21st century Berlin has emerged as a major international creative centre.
1929	According to the Anholt–GfK Nation Brands Index, in 2014 Germany was the world's most respected nation among 50 countries (ahead of US, UK, and France).
1930	A global opinion poll for the BBC revealed that Germany is recognised for having the most positive influence in the world in 2013 and 2014.
1931	MusicLudwig van Beethoven (1770–1827), composer
1932	Symphony No. 5 100px  German classical music includes works by some of the world's most well-known composers.
1933	Dieterich Buxtehude composed oratorios for organ, which influenced the later work of Johann Sebastian Bach and Georg Friedrich Händel; these men were influential composers of the Baroque period.
1934	During his tenure as violinist and teacher at the Salzburg cathedral, Augsburg-born composer Leopold Mozart mentored one of the most noted musicians of all time:
1935	Wolfgang Amadeus Mozart.
1936	Ludwig van Beethoven was a crucial figure in the transition between the Classical and Romantic eras.
1937	Carl Maria von Weber and Felix Mendelssohn were important in the early Romantic period.
1938	Robert Schumann and Johannes Brahms composed in the Romantic idiom.
1939	Richard Wagner was known for his operas.
1940	Richard Strauss was a leading composer of the late Romantic and early modern eras.
1941	Karlheinz Stockhausen and Hans Zimmer are important composers of the 20th and early 21st centuries.
