812	Sir Lord Baltimore's 1970 debut album and both Humble Pie's debut and self-titled third album were all among the first albums to be described in print as \\"heavy metal\\", with As Safe As Yesterday Is being referred to by the term \\"heavy metal\\" in a 1970 review in Rolling Stone magazine.
813	Various smaller bands from the U.S., U.K, and Continental Europe, including Bang, Josefus, Leaf Hound, Primeval, Hard Stuff,  Truth and Janey, Dust, JPT Scare Band, Frijid Pink, Cactus, May Blitz, Captain Beyond, Toad, Granicus, Iron Claw, and Yesterday's Children, though lesser known outside of their respective scenes, proved to be greatly influential on the emerging metal movement.
814	In Germany, Scorpions debuted with Lonesome Crow in 1972.
815	Blackmore, who had emerged as a virtuoso soloist with Deep Purple's highly influential album Machine Head (1972), left the band in 1975 to form Rainbow with Ronnie James Dio, singer and bassist for blues rock band Elf and future vocalist for Black Sabbath and heavy metal band Dio.
816	Rainbow with Ronnie James Dio would expand on the mystical and fantasy-based lyrics and themes sometimes found in heavy metal, pioneering both power metal and neoclassical metal.
817	These bands also built audiences via constant touring and increasingly elaborate stage shows.
818	As described above, there are arguments about whether these and other early bands truly qualify as \\"heavy metal\\" or simply as \\"hard rock\\".
819	Those closer to the music's blues roots or placing greater emphasis on melody are now commonly ascribed the latter label.
820	AC/DC, which debuted with High Voltage in 1975, is a prime example.
821	The 1983 Rolling Stone encyclopedia entry begins, \\"Australian heavy-metal band AC/DC\\".
822	Rock historian Clinton Walker writes, \\"Calling AC/DC a heavy metal band in the seventies was as inaccurate as it is today. ...
823	[They] were a rock 'n' roll band that just happened to be heavy enough for metal\\".
824	The issue is not only one of shifting definitions, but also a persistent distinction between musical style and audience identification: Ian Christe describes how the band \\"became the stepping-stone that led huge numbers of hard rock fans into heavy metal perdition\\".
825	In certain cases, there is little debate.
826	After Black Sabbath, the next major example is Britain's Judas Priest, which debuted with Rocka Rolla in 1974.
827	In Christe's description,Black Sabbath's audience was ... left to scavenge for sounds with similar impact.
828	By the mid-1970s, heavy metal aesthetic could be spotted, like a mythical beast, in the moody bass and complex dual guitars of Thin Lizzy, in the stagecraft of Alice Cooper, in the sizzling guitar and showy vocals of Queen, and in the thundering medieval questions of Rainbow. ...
829	Judas Priest arrived to unify and amplify these diverse highlights from hard rock's sonic palette.
830	For the first time, heavy metal became a true genre unto itself.
831	Though Judas Priest did not have a top 40 album in the United States until 1980, for many it was the definitive post-Sabbath heavy metal band; its twin-guitar attack, featuring rapid tempos and a non-bluesy, more cleanly metallic sound, was a major influence on later acts.
832	While heavy metal was growing in popularity, most critics were not enamored of the music.
833	Objections were raised to metal's adoption of visual spectacle and other trappings of commercial artifice, but the main offense was its perceived musical and lyrical vacuity: reviewing a Black Sabbath album in the early 1970s, leading critic Robert Christgau described it as \\"dull and decadent ...
834	dim-witted, amoral exploitation.
835	\\"Mainstream: late 1970s and 1980sIron Maiden, one of the central bands in the new wave of British heavy metal.
836	Punk rock emerged in the mid-1970s as a reaction against contemporary social conditions as well as what was perceived as the overindulgent, overproduced rock music of the time, including heavy metal.
837	Sales of heavy metal records declined sharply in the late 1970s in the face of punk, disco, and more mainstream rock.
838	With the major labels fixated on punk, many newer British heavy metal bands were inspired by the movement's aggressive, high-energy sound and \\"lo-fi\\", do it yourself ethos.
839	Underground metal bands began putting out cheaply recorded releases independently to small, devoted audiences.
840	Motörhead, founded in 1975, was the first important band to straddle the punk/metal divide.
841	With the explosion of punk in 1977, others followed.
842	British music papers such as the NME and Sounds took notice, with Sounds writer Geoff Barton christening the movement the \\"New Wave of British Heavy Metal\\".
843	NWOBHM bands including Iron Maiden, Saxon, and Def Leppard re-energized the heavy metal genre.
844	Following the lead set by Judas Priest and Motörhead, they toughened up the sound, reduced its blues elements, and emphasized increasingly fast tempos.
845	By 1980, the NWOBHM had broken into the mainstream, as albums by Iron Maiden and Saxon, as well as Motörhead, reached the British top 10.
846	Though less commercially successful, other NWOBHM bands such as Venom and Diamond Head would have a significant influence on metal's development.
847	In 1981, Motörhead became the first of this new breed of metal bands to top the UK charts with the live album No Sleep 'til Hammersmith.
848	The first generation of metal bands was ceding the limelight.
849	Deep Purple had broken up soon after Blackmore's departure in 1975, and Led Zeppelin broke up following drummer John Bonham's death in 1980.
850	Black Sabbath plagued with infighting and substance abuse, while facing fierce competition with their opening band, the Los Angeles band Van Halen.
851	Eddie Van Halen established himself as one of the leading metal guitarists of the era.
852	His solo on \\"Eruption\\", from the band's self-titled 1978 album, is considered a milestone.
853	 Eddie Van Halen's sound even crossed over into pop music when his guitar solo was featured on the track \\"Beat It\\" by Michael Jackson (a U.S. number 1 in February 1983).
854	Inspired by Van Halen's success, a metal scene began to develop in Southern California during the late 1970s.
855	Based on the clubs of L.A.'s Sunset Strip, bands such as Quiet Riot, Ratt, Mötley Crüe, and W.A.S.P. were influenced by traditional heavy metal of the earlier 1970s.
856	These acts incorporated the theatrics (and sometimes makeup) of glam metal or \\"hair metal\\" such as Alice Cooper and Kiss.
857	Glam metal bands were often visually distinguished by long, overworked hair styles accompanied by wardrobes which were sometimes considered cross-gender.
858	The lyrics of these glam metal bands characteristically emphasized hedonism and wild behavior, including lyrics which involved sexual expletives and the use of narcotics.
859	In the wake of the new wave of British heavy metal and Judas Priest's breakthrough British Steel (1980), heavy metal became increasingly popular in the early 1980s.
860	Many metal artists benefited from the exposure they received on MTV, which began airing in 1981—sales often soared if a band's videos screened on the channel.
861	Def Leppard's videos for Pyromania (1983) made them superstars in America and Quiet Riot became the first domestic heavy metal band to top the Billboard chart with Metal Health (1983).
862	One of the seminal events in metal's growing popularity was the 1983 US Festival in California, where the \\"heavy metal day\\" featuring Ozzy Osbourne, Van Halen, Scorpions, Mötley Crüe, Judas Priest, and others drew the largest audiences of the three-day event.
863	Between 1983 and 1984, heavy metal went from an 8 percent to a 20 percent share of all recordings sold in the U.S.
864	Several major professional magazines devoted to the genre were launched, including Kerrang!
865	(in 1981) and Metal Hammer (in 1984), as well as a host of fan journals.
866	In 1985, Billboard declared, \\"Metal has broadened its audience base.
867	Metal music is no longer the exclusive domain of male teenagers.
868	The metal audience has become older (college-aged), younger (pre-teen), and more female\\".
869	By the mid-1980s, glam metal was a dominant presence on the U.S. charts, music television, and the arena concert circuit.
870	New bands such as L.A.'s Warrant and acts from the East Coast like Poison and Cinderella became major draws, while Mötley Crüe and Ratt remained very popular.
871	Bridging the stylistic gap between hard rock and glam metal, New Jersey's Bon Jovi became enormously successful with its third album, Slippery When Wet (1986).
872	The similarly styled Swedish band Europe became international stars with The Final Countdown (1986).
873	Its title track hit number 1 in 25 countries.
874	In 1987, MTV launched a show, Headbanger's Ball, devoted exclusively to heavy metal videos.
875	However, the metal audience had begun to factionalize, with those in many underground metal scenes favoring more extreme sounds and disparaging the popular style as \\"light metal\\" or \\"hair metal\\".
876	One band that reached diverse audiences was Guns N' Roses.
877	In contrast to their glam metal contemporaries in L.A., they were seen as much more raw and dangerous.
878	With the release of their chart-topping Appetite for Destruction (1987), they \\"recharged and almost single-handedly sustained the Sunset Strip sleaze system for several years\\".
879	The following year, Jane's Addiction emerged from the same L.A. hard-rock club scene with its major label debut, Nothing's Shocking.
880	Reviewing the album, Rolling Stone declared, \\"as much as any band in existence, Jane's Addiction is the true heir to Led Zeppelin\\".
881	The group was one of the first to be identified with the \\"alternative metal\\" trend that would come to the fore in the next decade.
882	Meanwhile, new bands such as New York's Winger and New Jersey's Skid Row sustained the popularity of the glam metal style.
883	Other heavy metal genres: 1980s, 1990s, and 2000sDrummer Eric Moore from crossover thrash band Suicidal Tendencies.
884	Many subgenres of heavy metal developed outside of the commercial mainstream during the 1980s such as crossover thrash.
885	Several attempts have been made to map the complex world of underground metal, most notably by the editors of AllMusic, as well as critic Garry Sharpe-Young.
886	Sharpe-Young's multivolume metal encyclopedia separates the underground into five major categories: thrash metal, death metal, black metal, power metal, and the related subgenres of doom and gothic metal.
887	In 1990, a review in Rolling Stone suggested retiring the term \\"heavy metal\\" as the genre was \\"ridiculously vague\\".
888	The article stated that the term only fueled \\"misperceptions of rock & roll bigots who still assume that five bands as different as Ratt, Extreme, Anthrax, Danzig and Mother Love Bone\\" sound the same.
889	Thrash metalThrash metal band Slayer performing in 2007 in front of a wall of speaker stacks.
890	Thrash metal emerged in the early 1980s under the influence of hardcore punk and the new wave of British heavy metal, particularly songs in the revved-up style known as speed metal.
891	The movement began in the United States, with Bay Area thrash metal being the leading scene.
892	The sound developed by thrash groups was faster and more aggressive than that of the original metal bands and their glam metal successors.
893	Low-register guitar riffs are typically overlaid with shredding leads.
894	Lyrics often express nihilistic views or deal with social issues using visceral, gory language.
895	Thrash has been described as a form of \\"urban blight music\\" and \\"a palefaced cousin of rap\\".
896	The subgenre was popularized by the \\"Big Four of Thrash\\": Metallica, Anthrax, Megadeth, and Slayer.
897	Three German bands, Kreator, Sodom, and Destruction, played a central role in bringing the style to Europe.
898	Others, including San Francisco Bay Area's Testament and Exodus, New Jersey's Overkill, and Brazil's Sepultura and Sarcófago, also had a significant impact.
899	Although thrash began as an underground movement, and remained largely that for almost a decade, the leading bands of the scene began to reach a wider audience.
900	Metallica brought the sound into the top 40 of the Billboard album chart in 1986 with Master of Puppets, the genre's first platinum record.
901	Two years later, the band's ...And Justice for All hit number 6, while Megadeth and Anthrax also had top 40 records on the American charts.
902	Though less commercially successful than the rest of the Big Four, Slayer released one of the genre's definitive records: Reign in Blood (1986) was credited for incorporating heavier guitar timbres, and for including explicit depictions of death, suffering, violence and occult into thrash metal's lyricism.
903	Slayer attracted a following among far-right skinheads, and accusations of promoting violence and Nazi themes have dogged the band.
904	Even though Slayer did not receive substantial media exposure, their music played a key role in the development of extreme metal.
905	In the early 1990s, thrash achieved breakout success, challenging and redefining the metal mainstream.
906	Metallica's self-titled 1991 album topped the Billboard chart, as the band established international following.
907	Megadeth's Countdown to Extinction (1992) debuted at number two, Anthrax and Slayer cracked the top 10, and albums by regional bands such as Testament and Sepultura entered the top 100.
908	Death metalDeath's Chuck Schuldiner, \\"widely recognized as the father of death metal\\".
909	Thrash soon began to evolve and split into more extreme metal genres.
910	\\"Slayer's music was directly responsible for the rise of death metal,\\" according to MTV News.
911	The NWOBHM band Venom was also an important progenitor.
912	The death metal movement in both North America and Europe adopted and emphasized the elements of blasphemy and diabolism employed by such acts.
913	Florida's Death, San Francisco Bay Area's Possessed, and Ohio's Necrophagia are recognized as seminal bands in the style.
914	Both groups have been credited with inspiring the subgenre's name, the latter via its 1984 demo Death Metal and the song \\"Death Metal\\", from its 1985 debut album Seven Churches (1985).
915	In the late 1980s and early 1990s, Swedish death metal became notable and melodic forms of death metal were created.
916	Death metal utilizes the speed and aggression of both thrash and hardcore, fused with lyrics preoccupied with Z-grade slasher movie violence and Satanism.
917	Death metal vocals are typically bleak, involving guttural \\"death growls\\", high-pitched screaming, the \\"death rasp\\", and other uncommon techniques.
918	Complementing the deep, aggressive vocal style are downtuned, heavily distorted guitars and extremely fast percussion, often with rapid double bass drumming and \\"wall of sound\\"–style blast beats.
919	Frequent tempo and time signature changes and syncopation are also typical.
920	Death metal, like thrash metal, generally rejects the theatrics of earlier metal styles, opting instead for an everyday look of ripped jeans and plain leather jackets.
921	One major exception to this rule was Deicide's Glen Benton, who branded an inverted cross on his forehead and wore armor on stage.
922	Morbid Angel adopted neo-fascist imagery.
923	These two bands, along with Death and Obituary, were leaders of the major death metal scene that emerged in Florida in the mid-1980s.
924	In the UK, the related style of grindcore, led by bands such as Napalm Death and Extreme Noise Terror, emerged from the anarcho-punk movement.
925	Black metalThe first wave of black metal emerged in Europe in the early and mid-1980s, led by the United Kingdom's Venom, Denmark's Mercyful Fate, Switzerland's Hellhammer and Celtic Frost, and Sweden's Bathory.
926	By the late 1980s, Norwegian bands such as Mayhem and Burzum were heading a second wave.
927	Black metal varies considerably in style and production quality, although most bands emphasize shrieked and growled vocals, highly distorted guitars frequently played with rapid tremolo picking, a dark atmosphere and intentionally lo-fi production, with ambient noise and background hiss.
928	Satanic themes are common in black metal, though many bands take inspiration from ancient paganism, promoting a return to supposed pre-Christian values.
929	Numerous black metal bands also \\"experiment with sounds from all possible forms of metal, folk, classical music, electronica and avant-garde\\".
930	Darkthrone drummer Fenriz explains, \\"It had something to do with production, lyrics, the way they dressed and a commitment to making ugly, raw, grim stuff.
931	There wasn't a generic sound.
932	\\"Although bands such as Sarcófago had been donning corpsepaint, by 1990, Mayhem was regularly wearing corpsepaint; many other black metal acts also adopted the look.
933	Bathory inspired the Viking metal and folk metal movements and Immortal brought blast beats to the fore.
934	Some bands in the Scandinavian black metal scene became associated with considerable violence in the early 1990s, with Mayhem and Burzum linked to church burnings.
935	Growing commercial hype around death metal generated a backlash; beginning in Norway, much of the Scandinavian metal underground shifted to support a black metal scene that resisted being co-opted by the commercial metal industry.
936	By 1992, black metal scenes had begun to emerge in areas outside Scandinavia, including Germany, France, and Poland.
937	The 1993 murder of Mayhem's Euronymous by Burzum's Varg Vikernes provoked intensive media coverage.
938	Around 1996, when many in the scene felt the genre was stagnating, several key bands, including Burzum and Finland's Beherit, moved toward an ambient style, while symphonic black metal was explored by Sweden's Tiamat and Switzerland's Samael.
939	In the late 1990s and early 2000s decade, Norway's Dimmu Borgir brought black metal closer to the mainstream, as did Cradle of Filth.
940	Power metalSwedish power metal band HammerFall after a concert in Milan, Italy, in 2005.
941	Italian band Rhapsody of Fire performing in Buenos Aires in 2010.
942	During the late 1980s, the power metal scene came together largely in reaction to the harshness of death and black metal.
943	Though a relatively underground style in North America, it enjoys wide popularity in Europe, Japan, and South America.
944	Power metal focuses on upbeat, epic melodies and themes that \\"appeal to the listener's sense of valor and loveliness\\".
945	The prototype for the sound was established in the mid-to-late 1980s by Germany's Helloween, which combined the power riffs, melodic approach, and high-pitched, \\"clean\\" singing style of bands like Judas Priest and Iron Maiden with thrash's speed and energy, \\"crystalliz[ing] the sonic ingredients of what is now known as power metal\\".
946	Traditional power metal bands like Sweden's HammerFall, England's DragonForce, and America's Iced Earth have a sound clearly indebted to the classic NWOBHM style.
947	Many power metal bands such as America's Kamelot, Finnish groups Nightwish, Stratovarius and Sonata Arctica, Italy's Rhapsody of Fire, and Russia's Catharsis feature a keyboard-based \\"symphonic\\" sound, sometimes employing orchestras and opera singers.
948	Power metal has built a strong fanbase in Japan and South America, where bands like Brazil's Angra and Argentina's Rata Blanca are popular.
949	Closely related to power metal is progressive metal, which adopts the complex compositional approach of bands like Rush and King Crimson.
950	This style emerged in the United States in the early and mid-1980s, with innovators such as Queensrÿche, Fates Warning, and Dream Theater.
951	The mix of the progressive and power metal sounds is typified by New Jersey's Symphony X, whose guitarist Michael Romeo is among the most recognized of latter-day shredders.
952	Doom metalEmerging in the mid-1980s with such bands as California's Saint Vitus, Maryland's The Obsessed, Chicago's Trouble, and Sweden's Candlemass, the doom metal movement rejected other metal styles' emphasis on speed, slowing its music to a crawl.
953	Doom metal traces its roots to the lyrical themes and musical approach of early Black Sabbath.
954	The Melvins have also been a significant influence on doom metal and a number of its subgenres.
955	Doom emphasizes melody, melancholy tempos, and a sepulchral mood relative to many other varieties of metal.
956	The 1991 release of Forest of Equilibrium, the debut album by UK band Cathedral, helped spark a new wave of doom metal.
957	During the same period, the doom-death fusion style of British bands Paradise Lost, My Dying Bride, and Anathema gave rise to European gothic metal, with its signature dual-vocalist arrangements, exemplified by Norway's Theatre of Tragedy and Tristania.
958	New York's Type O Negative introduced an American take on the style.
959	In the United States, sludge metal, mixing doom and hardcore, emerged in the late 1980s—Eyehategod and Crowbar were leaders in a major Louisiana sludge scene.
960	Early in the next decade, California's Kyuss and Sleep, inspired by the earlier doom metal bands, spearheaded the rise of stoner metal, while Seattle's Earth helped develop the drone metal subgenre.
961	The late 1990s saw new bands form such as the Los Angeles–based Goatsnake, with a classic stoner/doom sound, and Sunn O))), which crosses lines between doom, drone, and dark ambient metal—the New York Times has compared their sound to an \\"Indian raga in the middle of an earthquake\\".
962	1990s and early 2000s subgenres and fusionsItalian band Lacuna Coil, one of the most successful gothic metal groups.
963	The era of heavy metal's mainstream dominance in North America came to an end in the early 1990s with the emergence of Nirvana and other grunge bands, signaling the popular breakthrough of alternative rock.
964	Grunge acts were influenced by the heavy metal sound, but rejected the excesses of the more popular metal bands, such as their \\"flashy and virtuosic solos\\" and \\"appearance-driven\\" MTV orientation.
965	Glam metal fell out of favor due not only to the success of grunge, but also because of the growing popularity of the more aggressive sound typified by Metallica and the post-thrash groove metal of Pantera and White Zombie.
966	In 1991, the band Metallica released their album Metallica, also known as The Black Album, which moved the band's sound out of the thrash metal genre and into standard heavy metal.
967	The album was certified 16× Platinum by the RIAA.
968	A few new, unambiguously metal bands had commercial success during the first half of the decade—Pantera's Far Beyond Driven topped the Billboard chart in 1994—but, \\"In the dull eyes of the mainstream, metal was dead\\".
969	Some bands tried to adapt to the new musical landscape.
970	Metallica revamped its image: the band members cut their hair and, in 1996, headlined the alternative musical festival Lollapalooza founded by Jane's Addiction singer Perry Farrell.
971	While this prompted a backlash among some long-time fans, Metallica remained one of the most successful bands in the world into the new century.
972	Layne Staley of Alice in Chains, one of the most popular acts identified with alternative metal performing in 1992.
973	Like Jane's Addiction, many of the most popular early 1990s groups with roots in heavy metal fall under the umbrella term \\"alternative metal\\".
974	Bands in Seattle's grunge scene such as Soundgarden, credited as making a \\"place for heavy metal in alternative rock\\", and Alice in Chains were at the center of the alternative metal movement.
975	The label was applied to a wide spectrum of other acts that fused metal with different styles: Faith No More combined their alternative rock sound with punk, funk, metal, and hip hop; Primus joined elements of funk, punk, thrash metal, and experimental music; Tool mixed metal and progressive rock; bands such as Fear Factory, Ministry and Nine Inch Nails began incorporating metal into their industrial sound, and vice versa, respectively; and Marilyn Manson went down a similar route, while also employing shock effects of the sort popularized by Alice Cooper.
976	Alternative metal artists, though they did not represent a cohesive scene, were united by their willingness to experiment with the metal genre and their rejection of glam metal aesthetics (with the stagecraft of Marilyn Manson and White Zombie—also identified with alt-metal—significant, if partial, exceptions).
977	Alternative metal's mix of styles and sounds represented \\"the colorful results of metal opening up to face the outside world.
978	\\"In the mid- and late 1990s came a new wave of U.S. metal groups inspired by the alternative metal bands and their mix of genres.
979	Dubbed \\"nu metal\\", bands such as Slipknot, Linkin Park, Limp Bizkit, Papa Roach, P.O.D., Korn and Disturbed incorporated elements ranging from death metal to hip hop, often including DJs and rap-style vocals.
980	The mix demonstrated that \\"pancultural metal could pay off\\".
981	Nu metal gained mainstream success through heavy MTV rotation and Ozzy Osbourne's 1996 introduction of Ozzfest, which led the media to talk of a resurgence of heavy metal.
982	In 1999, Billboard noted that there were more than 500 specialty metal radio shows in the United States, nearly three times as many as ten years before.
983	While nu metal was widely popular, traditional metal fans did not fully embrace the style.
984	By early 2003, the movement's popularity was on the wane, though several nu metal acts such as Korn or Limp Bizkit retained substantial followings.
